,Title,Published_date,Views,Likes,Dislikes,Comments,videoid
0,Moving On,2024-04-22,6289,342,0,72,QEDZaBMozIo
1,How Does ChatGPT Image Analysis Do on an IQ Test?,2023-11-30,2376,70,0,21,Hyhfa7z0jTk
2,A Data Dream Come True,2023-11-17,2221,92,0,23,L5Cis5bOwgw
3,The Death of the Full-Time Job (Rise of the Contractor),2023-09-22,6084,402,0,77,M1I5HlzQges
4,How to Survive a Down Data Job Market,2023-09-05,17158,565,0,63,T_-0l0ORi5I
5,The Harsh Reality of the Data Job Market,2023-08-24,107507,2611,0,294,w13zJB_jyBI
6,7 Industries AI will Aggressively Disrupt,2023-08-14,6278,246,0,41,oZ9rMrqyTbI
7,What's in My Data Science Travel Bag? (50+ Flights Last Year),2023-08-07,4276,132,0,48,6BrYKdqq4uA
8,7 Enticing Jobs AI Will Create,2023-07-24,4754,199,0,37,1dAvbIMrLos
9,The ChatGPT Code Interpreter is OVERRATED,2023-07-22,4133,144,0,31,lqYxmYMkfK8
10,Exciting Announcement!,2023-06-23,6678,298,0,50,-JTU734oMfk
11,AI: A Customer Service Revolution?,2023-05-26,3934,123,0,35,HVpbmu7rFYE
12,Beginner Kaggle Data Science Project Walk-Through (Housing Prices) | With ChatGPT,2023-05-16,43767,1426,0,59,NQQ3DRdXAXE
13,How I Would Learn Data Science with AI (If I Could Start Over),2023-05-04,34798,1470,0,77,xpi-M2j3NmE
14,This AI question will determine our future,2023-04-06,4299,261,0,37,X07w7QFoLpc
15,I'll Never Code the Same Again... (GPT-4 is OP),2023-04-03,71348,836,0,78,RRnThAtKuq0
16,Your current portfolio is actually hurting you #shorts,2023-03-30,8427,484,0,7,r3zOpjEOkgE
17,"Traditional ""networking"" is stupid. Do THIS instead #shorts",2023-03-27,7573,406,0,2,s-XYFEzy9Wc
18,you're job searching wrong. #shorts,2023-03-23,4431,262,0,3,iBh1wl4o6V4
19,The Economics of Data Roles #shorts,2023-03-21,9942,603,0,12,L6lXKdP4Qbg
20,Why your phone knows everything you say #shorts,2023-03-18,3476,161,0,8,xGDl6rlBygU
21,Read these for a successful career. #shorts,2023-03-16,3187,247,0,2,SY6y6Y8C594
22,Is Your Phone Actually Listening to You? #shorts,2023-03-09,2677,47,0,5,1RUj2aLQx8I
23,How I Realized I Was a Bad Manager #shorts,2023-03-07,2875,138,0,1,MkzZXSw1Glk
24,How I Use ChatGPT as a Data Scientist (4-5 hrs Saved Per Week),2023-03-03,20679,765,0,51,9neDFXTxKxA
25,Why I Quit Data Science... and then crawled back #shorts,2023-03-01,8342,274,0,13,UaNNVukM27g
26,The Best Place to Look for Data Science Opportunities #shorts,2023-02-27,2766,168,0,2,3lN0-S3symM
27,Learning On the companies dime #shorts,2023-02-24,3236,175,0,1,M-AN8eWLxms
28,The Best Way to Transition to Data Science? #shorts,2023-02-21,4431,278,0,6,MXFZhbvQqM8
29,Avoid this Massive Data Science Learning Mistake #shorts,2023-02-17,7249,405,0,6,54n61XjKifI
30,Don't Go into Data for the Money #shorts,2023-02-15,3804,220,0,12,pyWYIRR8rrE
31,First Data Science Project? Watch This.,2023-02-13,7725,375,0,24,onwRfbt--cw
32,How to Approach Applying for a Data Role #shorts,2023-02-08,3694,244,0,7,u6P23ouSYhA
33,The Hard Reality of Data Science Work #shorts,2023-02-06,16670,886,0,17,RMMVuvS7S_g
34,How Much Money Does a Data Scientist Make? #shorts,2023-02-03,4827,195,0,6,5AwbPAV8FS0
35,These 3 Things Make Data Science Special #shorts,2023-02-01,4345,347,0,7,A2OQgU0IRNo
36,Will Data Science Be Automated? #shorts,2023-01-27,10290,430,0,9,x5Q_nrIqFik
37,Is Data Science A Good Fit For You? #shorts,2023-01-25,5177,294,0,11,7ja2ELBVMlU
38,5 Books I Wish I Read Earlier In My Career,2023-01-23,9612,525,0,50,Z2MyLQa_vVw
39,How To Start Working on Data Science Projects (As a Beginner) #shorts,2023-01-19,9563,742,0,15,JTlB9fwYRk0
40,What Data Science Tool Would I Learn First? #shorts,2023-01-17,6336,475,0,10,OJDf_fTENJ4
41,How long does it take to become a Data Scientist? #shorts,2023-01-12,7210,506,0,6,nqCkdqhV-JY
42,Where & how to start your Data Science Journey #shorts,2023-01-09,7053,423,0,2,b8t8lDL13sg
43,How I Would NOT Learn Data Science in 2023.,2023-01-03,128460,4203,0,256,t6CD1EwU5kc
44,The Greatest Data Science Event You Never Heard Of  [Behind The Scenes],2022-12-14,4948,208,0,28,eIxHe45hzhQ
45,The Essential Programming Concepts For Learning Data Science,2022-11-14,20736,858,0,46,3NJOWWvNK3I
46,The Data Content House: What You Missed,2022-10-07,10568,349,0,49,4_VtMWJSo1o
47,Is Data Science A Good Career?,2022-09-29,63461,1971,0,140,OybXWl3IWvI
48,IRON ANALYST (Teaser) #shorts,2022-09-27,5666,364,0,24,nRHPQ5ZeB5Y
49,When a New Data Scientist Joins The Team,2022-08-29,16725,754,0,134,0JWC4M0Qhqc
50,State of Data Science - Web Data,2022-08-05,10480,353,0,34,oNvyvYGw5n4
51,Data Science Town Hall - State of Data Science,2022-08-04,10008,367,0,37,GaZRuchRCyw
52,The Programming Roadmap For Data Science,2022-07-29,28092,1315,0,63,EBjYqC3aNTA
53,5 Impactful Data Science Projects For Your Portfolio,2022-06-27,91110,3291,0,94,QMP858aZcow
54,Can AI Fix my Baseball Swing?,2022-06-10,7819,344,0,68,0ItYIoOrrUs
55,Every Data Scientist... (funny!),2022-05-24,17440,858,0,146,KzTFoUbThvM
56,State of Data Science (Town Hall) ft - Data Squad,2022-05-07,16008,426,0,65,bBJd0oPdNak
57,Data Science Portfolio Project From Scratch | Building a YouTube Data Dashboard with Streamlit,2022-04-04,68112,1680,0,85,Yk-unX4KnV4
58,Why You Are NOT Landing Data Jobs ... Yet,2022-03-25,22041,903,0,110,z0_xrtFdFj8
59,Data Scientists VS NFT Scam,2022-03-03,4818,189,0,41,vVpkXEIn-q0
60,When a PM Joins the Data Team... (funny!) - Ft @LukeBarousse,2022-02-21,11339,513,0,144,aipz4p7GDL4
61,What Professional Data Scientists ACTUALLY Do,2022-02-14,100017,3445,0,187,iPdO9MwdcLE
62,Can You Analyze My Data Better Than I Can?,2022-01-31,7489,324,0,60,YPph59-rTxA
63,Giving Back to My Most Engaged Subscribers!,2022-01-28,2336,118,0,87,-2U2CMYom00
64,How to Make $1 Billion Betting on Horse Racing with Machine Learning,2022-01-24,48520,1201,0,140,KEeUR8UDy-s
65,Should You Be Excited About Web 3? (As a Data Scientist),2022-01-17,8948,425,0,82,0jTtHYie3CU
66,Should  @LukeBarousse Take This Data Analyst Job? (Funny) #Shorts,2022-01-14,8613,255,0,33,2RWwN5ZT4tA
67,The Only Data Science Explanation You Need,2022-01-10,64993,2280,0,172,rEWPqw6rMGI
68,We Need to Talk About The LinkedIn Machine Learning Assessment.,2022-01-03,14557,647,0,144,o-wsyxWbPOw
69,How I Would Learn Data Science in 2022 (If I Had to Start Over),2021-12-27,344563,15018,0,532,xpIFS6jZbe8
70,What the Heck is WSL 2? (My New Favorite Tool),2021-12-17,15297,496,0,67,-zbLpoJVBMI
71,How Statistics Saved the US SERIOUS $$$$ During WW2 #Shorts,2021-12-10,8090,572,0,25,scSc6YSanQ0
72,How Zillow Lost $500 MILLION With Machine Learning,2021-12-03,25034,1182,0,142,FqNpDNmpcEo
73,Why Is Data Engineering So HOT Right Now?,2021-11-26,29714,1100,0,137,vwvdtXMcNzI
74,Is Data Science Dying?,2021-11-19,125453,3898,0,360,2qVWurPFwfc
75,7 Incredible Books That Transformed My Health and My Life,2021-11-12,8506,399,0,113,35g8fCi-kbw
76,Why EVERYONE Should Start a Podcast (Including YOU),2021-11-05,3644,202,0,44,n6MiRgxN5iA
77,Building a Burrito Dashboard - Data Science Project from Scratch with atoti,2021-10-29,14077,307,0,39,ammCGdzSoag
78,ML Ops: What is it REALLY?,2021-10-22,7232,286,0,66,15c7WD-lKUY
79,Business Skills for Data Science: What are they REALLY?,2021-10-18,6924,303,0,50,TjGFBQC27ng
80,#66DaysOfData Round 3 Live Event! (feat. @statquest),2021-10-12,2217,122,0,5,qUK5Vk4NvBw
81,Roasting My First Data Science Project (Common Project Mistakes),2021-10-08,6005,283,0,64,cnqTU6eJwH0
82,Is Data Visualization Important for Data Science? (A Data Scientist's Perspective),2021-08-20,13047,533,0,108,k8YxyrcAXJs
83,Project Presentation - Expectations vs. Reality (funny) #shorts,2021-08-07,10339,436,0,32,VvnOXDCVm8k
84,Data Science Project - Expectations vs Reality (funny) #shorts,2021-08-06,42072,1618,0,32,68GGPK3WaqI
85,How I Learned to Learn.,2021-07-31,50992,2362,0,209,S4Lei5mOppc
86,Is Spotify Shuffle Really Random? #Shorts,2021-07-21,11191,609,0,51,tG_UW_p0UqE
87,I Eat a Papaya Live on Stream (Plus Q&A for 150K Subs!),2021-07-16,2464,92,0,30,143WWA5Sy9k
88,Why are APIs Important for Data Science?,2021-07-09,10569,467,0,95,s1gD35Z4eUc
89,Is Your Phone REALLY Listening to You?,2021-07-03,5239,279,0,116,nrEJGGxcoTc
90,Kaggle vs Github - Which is Best for Your Data Science Portfolio?,2021-06-25,16814,639,0,123,KfpOuSH9gDc
91,#66DaysOfData - 3 Reasons to Start!,2021-06-18,4115,225,0,41,sICJ6a2wX5g
92,#66DaysOfData - What is it? #shorts,2021-06-11,9477,399,0,54,iiSZqsQKNX8
93,A Quick Data Science Project Tip! #SHORTS,2021-06-03,16915,1030,0,89,IoUWD1h6xUs
94,Discouraged with Data Science? - Watch THIS video.,2021-05-28,7533,391,0,195,7JCterBrcvk
95,How Data Science Projects Pay Off,2021-05-22,11007,606,0,146,KU__lDJj5iU
96,How I Use Data to Optimize My Life | What I Collect & How I Analyze It,2021-05-14,10735,489,0,134,8nTmuKI2oyA
97,What is a lambda function (python)? #shorts,2021-05-13,16083,973,0,49,SaWxVk7rDp4
98,Why Kaggle Should Be Your Favorite Data Science Resource #shorts,2021-05-07,33758,1745,0,63,n7kjelw9s2w
99,What is Pandas? (Data & Data Science) #shorts,2021-04-30,25064,1287,0,85,8Pi36Nj6P9A
100,The 7 Biggest Data Science  Beginner Mistakes,2021-04-23,77673,3438,0,284,hOUrxTeBJQc
101,Data Scientist Reacts: REAL Data Science Job Application Data,2021-04-16,23646,696,0,85,-ONQ628CXKQ
102,Why You Probably Won't Become a Data Scientist,2021-04-09,139020,4038,0,474,sHRq-LshG3U
103,How to Go From Data Analyst to Data Scientist,2021-04-02,55170,1568,0,178,EMq4PH7PCeA
104,Why I Have 2 Offices for Data Science & Content Creation,2021-03-26,4020,139,0,92,BlSrorP32WM
105,MARCH MADNESS - Will My Machine Learning Model Beat Your Bracket?,2021-03-19,18782,361,0,108,pPfw2fzwNiM
106,My Regrets as a Data Science Student,2021-03-12,24059,881,0,112,hcHSSyHbgMQ
107,My Daily Battle With Time - Will I Win? [Vlog],2021-03-08,3852,195,0,83,ITAxTid_1YU
108,What is the Future of my Comment Leaderboard Project?,2021-02-26,5607,201,0,81,fU3DOXjwufg
109,How to Build a Website  - Building my ULTIMATE Portfolio Website,2021-02-19,6997,176,0,51,tJI-1mHeXoA
110,Why I Quit Data Science,2021-02-12,105405,2351,0,347,SVtRsDhHlDk
111,🌶 Hot Topics in Tech: Data Science Explained #SHORTS,2021-01-29,10812,560,0,116,OtqQYqRNDGI
112,How I Balance Data Science and Content Creation (7 Secrets),2021-01-23,7036,292,0,126,uic34RTaI-w
113,Kaggle Project From Scratch - Part 3 (Advanced Graphs & Gender Imbalance Analysis),2021-01-16,10169,310,0,52,GO420aMtHfk
114,Kaggle Project From Scratch - Part 2 (Exploratory Data Analysis),2021-01-08,23773,707,0,134,KQ80oD_boBM
115,Kaggle Project From Scratch - Part 1 (Data Science Profession Survey),2021-01-02,39684,1164,0,148,r-DR9HBaipU
116,What is the #66DaysOfData?,2020-12-26,70857,2338,0,200,qV_AlRwhI3I
117,How I Would Learn Data Science in 2021 (What Has Changed?),2020-12-19,131751,5952,0,488,41Clrh6nv1s
118,Unboxing the Ultimate Z by HP Data Science Package (FIRST EVER HP Workstation w/ Data Science Stack),2020-12-10,11132,402,0,133,YR9Faf1uZDg
119,I Built the FIRST EVER YouTube Subscriber LEADERBOARD,2020-12-07,23757,724,0,324,myhoWUrSP7o
120,7 Things to Look For in a Masters For Data Science (feat. @TinaHuang1),2020-11-20,28700,871,0,160,ji7DtgUeKCI
121,6 Lessons from #66DaysOfData,2020-11-13,6775,338,0,93,4039x4r-hGE
122,100K Channel Update + AMA Stream!,2020-11-12,2322,126,0,22,78LjdAAw0wA
123,Find a Data Science Project With These 3 Techniques,2020-11-06,17049,733,0,106,yUrrf3Pm33s
124,How I Chose My Masters Degree for Breaking into Data Science,2020-10-30,28177,689,0,155,domVw8isGOI
125,git for Data Science Made Simple... (Hopefully),2020-10-23,21468,913,0,92,_0rHU6qAQe0
126,The PODCAST you might have asked for?,2020-10-19,2128,93,0,44,tnpV1etgcxs
127,Dealing with Doubt in Data Science (My Impostor Syndrome Story),2020-10-16,6804,450,0,113,Uf0dO-pgOrk
128,Advice from a Data Analytics CEO (@How to Get an Analytics Job) - KNN EP. 17,2020-10-14,14735,428,0,47,N97MhZEp2UQ
129,Data Science Resume Round-Up With @Tina Huang  | Episode 3,2020-10-12,7079,150,0,62,1Ir1NgCuI0Y
130,5 Unusual Data Science Projects that Will Land You a Job,2020-10-09,12367,580,0,83,d6FeV8WXPWY
131,Sh*t Data Scientists Say (Parody),2020-10-05,9705,581,0,144,WRF_dKZ_i24
132,5 Proven Strategies to Break into a Data Science Job,2020-10-02,8641,364,0,93,UpaEjBOMNqs
133,Why Data-Viz is so Darn Important (@Story by Data | Kate Strachnyi) - KNN EP. 16,2020-09-30,7101,287,0,61,UKuK2fXu_dU
134,Data Science Resume Round-Up With @TinaHuang1  - Episode 1,2020-09-28,11969,291,0,69,Ft4GVkQQtgk
135,5 Essential Data Science Projects for Your Portfolio,2020-09-26,74360,3133,0,206,BBDiadC8BvE
136,His Startup Will Land You a Data Science Job (Jeremie Harris) - KNN EP. 15,2020-09-23,5229,199,0,64,7VcdvSyoxnc
137,Reviewing Your Data Science Projects - Episode 21(The Cleanest Portfolio),2020-09-21,13997,523,0,60,8Vxjp2KVHqs
138,"Hedge Funds, Startups, and Data Science Oh my! (@DataLeap) - KNN EP. 14",2020-09-18,7554,253,0,34,Kq9dkZu0bpg
139,Land a Data Science Job in a Different Country (Vijay Pravin Maharajan) - KNN EP. 13,2020-09-16,5128,197,0,56,omdhf8d53FM
140,Reviewing Your Data Science Projects - Episode 20 (Bootcamp Capstone),2020-09-14,4361,156,0,35,apf6A3Nstm8
141,The 5 Pillars of Success I Live By,2020-09-11,10165,872,0,152,jf3j0lWmFPU
142,Fast Cars to Faster Data (Alex Castrounis) - KNN EP. 12,2020-09-09,1897,79,0,25,g7on3Rw0Ovg
143,Reviewing Your Data Science Projects - Episode 19 (One Big Improvement),2020-09-07,4061,164,0,43,rLawTH--l2Y
144,How I Learn Data Science Through Studying Other People's Code | #66DaysOfData,2020-09-04,11978,744,0,145,-pdXWmj9xxU
145,How She Dominated the FAANG Data Science Interview  (@TinaHuang1 ) - KNN EP. 11,2020-09-02,18099,575,0,89,vfV4nm004VQ
146,Reviewing Your Data Science Projects - Episode 18 (Job-Worthy GitHub),2020-08-31,18308,796,0,93,oHUD2T_VXfI
147,Why I'm Starting Data Science Over Again.,2020-08-29,50839,2595,0,450,uXLnbdHMf8w
148,Inside the Mind of the Ultimate Kaggle Grandmaster (@Abhishek Thakur ) - KNN EP. 10,2020-08-26,15418,638,0,78,5v_ulmGv-gc
149,Reviewing Your Data Science Projects - Episode 17 (Best Portfolio Website Yet?),2020-08-24,13455,474,0,55,q6Lf2yhvluw
150,Don't Buy My Course..,2020-08-21,7352,359,0,146,iGUiLWFDWfk
151,How a Subscriber Landed a Data Analyst Job in Less Than a Year (Ray Ojel) - KNN EP. 09,2020-08-19,29169,1109,0,166,SsGKZe4dVyk
152,Reviewing Your Projects - Episode 16 (Project Review for Beginners),2020-08-17,3262,127,0,38,RAMxzqSMDKE
153,Data Scientist Dismantles the YouTube Algorithm.,2020-08-14,6377,539,0,108,YbTMIxjk4hI
154,Sports Analytics & Streaming Data Science on Twitch (Nick Wan) - KNN EP. 08,2020-08-12,5088,188,0,39,S_CuB__nsmI
155,Reviewing Your Data Science Projects - Episode 15 (Quant Finance),2020-08-10,13303,418,0,53,KEBVcVwFzaI
156,The Plagiarism Problem in Data Science,2020-08-07,13121,628,0,145,vQGJvmhpq_s
157,Interview with the Director of AI Research @ NVIDIA (Anima Anandkumar) - KNN EP. 07,2020-08-05,14538,603,0,89,Xgg7dIKys9E
158,Reviewing Your Data Science Projects - Episode 14 [Deep Learning Focus],2020-08-03,4948,186,0,56,UuR3nomI5AE
159,My First Data Science Contracting Side-Gig (How I Did It),2020-07-31,11549,582,0,90,6tQtwqthUMI
160,Do You Have a Data Science Mentor? (@Danny Ma) - KNN EP. 06,2020-07-30,2344,116,0,34,QN3wXPZSjpE
161,Reviewing Your Data Science Projects - Episode 13 (BONUS LinkedIn Review),2020-07-27,5771,253,0,112,rdo8YBasqqA
162,Building a Deep Learning BEAST (NVIDIA TITAN RTX + RYZEN 3900X),2020-07-24,8300,246,0,199,_rbrdNTpZGo
163,Is it Important to Share Your Data Science Work? (Ft. Eric Weber),2020-07-22,1878,97,0,27,ELFGsNqZrlM
164,Reviewing Your Data Science Resumes - Episode 12 (3 Different Resumes!),2020-07-20,29388,564,0,90,PWmxLYTixAM
165,Beginner Kaggle Data Science Project Walk-Through (Titanic),2020-07-17,362774,7842,0,439,I3FBJdiExcg
166,Uber Driver to Machine Learning Engineer in 9 Months! (@Daniel Bourke) - KNN EP. 05,2020-07-16,30541,1125,0,121,hO_YKK_0Qck
167,Reviewing Your Data Science Projects - Episode 11(GITHUB CLEANING),2020-07-13,3664,133,0,50,2KkrtG5IsHo
168,The Best Computer for Data Science Beginners,2020-07-10,39438,862,0,158,QQLToUlgN7A
169,Should You Major in Data Science? (Jaemin Lee) - KNN EP. 04,2020-07-08,6181,231,0,82,6aaIbd-GpZs
170,Critiquing MY OWN Data Science Resume,2020-07-06,12796,399,0,88,lsXWVPzwZPk
171,Where to Start Learning Data Science,2020-07-03,19097,783,0,125,AqPquogHwq0
172,"Data Science Productivity, Motivation, and Organization (ft. Data Professor & Codebasics)",2020-07-01,4226,198,0,35,742LQ38OioU
173,Reviewing Your Data Science Projects - Episode 10 (Leveraging Your Data),2020-06-29,4640,176,0,52,B1g_yMKpdwo
174,How to Get a Data Science Job at FAANG (@Data Science Jay) - KNN EP. 03,2020-06-26,16768,552,0,79,zGlJ-QndG8E
175,Reviewing Your Data Science Projects - Episode 9 (Professional Violinist),2020-06-22,2436,82,0,40,6fwyyRgZlD0
176,"Ken Jee Q & A Live Stream (50,000 Sub Special!)",2020-06-20,2390,139,0,49,-3d1NctSv0c
177,Reviewing Your Data Science Projects - Episode 8 (College Student Help),2020-06-15,4422,168,0,46,WnB1jsDu900
178,Why You're Struggling to Learn Data Science,2020-06-12,15333,1008,0,159,XjC3FPL-S78
179,Reviewing Your Data Science Projects - Episode 7 (Incredible Portfolio Website),2020-06-08,12198,363,0,70,txR8_jGi0Ls
180,The State of Data Science with Krish Naik & The Data Professor [Panel Discussion],2020-06-05,24362,692,0,146,4qZINLzwYyk
181,Reviewing Your Data Science Projects - Episode 6 (Only 3 months of coding experience),2020-06-01,5730,155,0,53,mR2NCRgtLPE
182,How to Build a Data Science Portfolio Website with Hugo & Github Pages [feat. Data Professor],2020-05-29,76918,2266,0,272,mEZ1Hj5yQ-8
183,Reviewing Your Data Science Projects - Episode 5 (Very Detailed Project),2020-05-25,21014,488,0,81,HJH0gfY6EUg
184,Different Data Science Roles Explained (by a Data Scientist),2020-05-22,56677,2007,0,178,BZFfNwj7JhE
185,Reviewing Your Data Science Projects - Episode 4 (Resume & Github),2020-05-18,11296,180,0,53,_K6cNdgN3CI
186,How to Make A Data Science Portfolio Website with Github Pages,2020-05-15,137887,4575,0,193,1aXk2RViq3c
187,10000 Subscriber and 100th Video Special (Data Science),2020-05-13,3105,147,0,115,UcilY6HDuL8
188,Reviewing Your Data Science Projects - Episode 3 (Student Portfolio),2020-05-11,4566,155,0,74,jam0xApfC-U
189,How I Would Learn Data Science (If I Had to Start Over),2020-05-08,1399816,48922,0,1989,4OZip0cgOho
190,Reviewing Your Data Science Projects - Episode 2 (Resume and Portfolio),2020-05-04,5613,198,0,42,QBIe4nbmZfA
191,What You Need to Know for a Data Science Internship,2020-05-01,22654,1217,0,60,KHAuuOQui2U
192,Reviewing Your Data Science Projects - Episode 1 (Exploratory Analysis),2020-04-27,8402,347,0,53,DW55gaQ_Egk
193,What It's Like to be a Socially Distanced Data Scientist (A Day in the Life),2020-04-24,15003,454,0,101,lUUqrRgerd8
194,Data Science in Sports - Talk for Northwestern (Kellogg) MBA Students,2020-04-22,3191,85,0,24,ei1m5lDQyBg
195,5 Tips for Crushing the Work From Home Life,2020-04-20,5455,200,0,38,9D7GzskcyUk
196,Data Science Project from Scratch - Part 7 (Documenting Your Work),2020-04-17,22438,749,0,129,agHKuUoMwvY
197,Data Science Project from Scratch -  Part 6 (Putting the Model into Production),2020-04-15,30702,741,0,98,nUOh_lDMHOU
198,Data Science Project from Scratch  - Part 5 (Model Building),2020-04-13,45867,923,0,155,7O4dpR9QMIM
199,Data Science Project from Scratch - Part 4 (Exploratory Data Analysis),2020-04-10,74834,1926,0,214,QWgg4w1SpJ8
200,Data Science Project from Scratch - Part 3 (Data Cleaning),2020-04-08,83707,1791,0,278,fhi4dOhmW-g
201,Data Science Project from Scratch - Part 2 (Data Collection),2020-04-06,134169,3583,0,623,GmW4F6MHqqs
202,Data Science Project from Scratch - Part 1 (Project Planning),2020-04-03,207272,5191,0,173,MpF9HENQjDo
203,When Data Science Goes Wrong,2020-03-30,1821,106,0,30,9ZwVqXUHf6o
204,How to ULTRALEARN Data Science,2020-03-27,62220,3813,0,168,a3VWq9smqhM
205,Why Right NOW is a Great Time to Learn Data Science,2020-03-23,4488,267,0,50,oMdVg6GPODA
206,Data Science Project Example Start to Finish (Deep Learning Image Classifier),2020-03-20,13675,476,0,45,vy-R4oUZaC8
207,The Secret Data Scientists Don't Want You to Know,2020-03-16,10891,1142,0,102,XGBigjVy2Eo
208,The 5 Stages of Learning Data Science,2020-03-13,17637,1297,0,78,hpMc6TgT34I
209,Can You Learn Data Science Without a Computer?,2020-03-11,1899,131,0,14,Fs_LG5Y8GIU
210,The Best Free Data Science Courses Nobody is Talking About,2020-03-09,349388,21222,0,621,Ip50cXvpWY4
211,The Data Science Projects that Got Me a Job,2020-03-06,41493,1397,0,41,imMPnCHvbkY
212,How to Integrate Data Science into Your Business,2020-03-02,3418,128,0,18,3bes4U4MHPg
213,The Problem with Data Science,2020-02-28,3820,153,0,18,qP0hRF-lGqg
214,How Much Did Cheating Help the Astros Win? (What the Numbers Say),2020-02-24,1203,45,0,16,aaAZXeuPIXk
215,How to Set Up Your Data Science Environment (Anaconda Beginner),2020-02-21,137887,2566,0,96,C4OPn58BLaU
216,3 Proven Data Science Projects for Beginners (Kaggle),2020-02-17,333220,17958,0,527,8igH8qZafpo
217,Data Science Advice for College Students,2020-02-14,69170,1965,0,195,xjhW1rSQeik
218,Avoid These Data Science Resume Mistakes!,2020-02-10,28827,1246,0,62,DM1eE_Coh6g
219,Data Science Explained with ... Cooking?,2020-02-07,5490,317,0,48,f6NPw582FFc
220,The 4 Types of Sports Analytics Projects,2020-02-03,33043,1069,0,62,dlZWB2D-NaQ
221,Data Science in Golf: PGA Merchandise Show 2020,2020-01-31,606,18,0,13,foggudmDDvY
222,How I Learned Data Science,2020-01-27,94383,2687,0,210,n3vw0M5RrPU
223,What is Sports Analytics Really?,2020-01-20,22306,632,0,74,2OnXytYziF0
224,Data Science Certificate vs Bootcamp vs Masters Degree,2020-01-18,112639,3150,0,575,Q9FjwzKFPuM
225,How To Learn Programming for Data Science [3 Steps],2020-01-13,30202,1981,0,96,VN12ZPFsApM
226,Data Science Fundamentals: SQL Queries,2020-01-10,6783,218,0,35,WKXtTo7lqmA
227,Questions You Should Ask Your Data Science Interviewers,2020-01-06,3176,150,0,14,9-2OKLZfvbE
228,The 9 Books That Changed My Perspective in 2019,2020-01-03,3405,177,0,25,3TrAYmrmA8o
229,The Data Science Interview: What to Expect,2019-12-30,8709,382,0,32,5SjK6YCs4o4
230,5 Data Science Resolutions for 2020,2019-12-27,476,25,0,12,iqG59TqfFdY
231,How to Scrape NBA Data Using the nba_api Python Module,2019-12-23,18195,630,0,95,NCyPY-jfb3I
232,Collision Course: Sports Betting + Data Science,2019-12-20,19826,529,0,27,DopikusDfk0
233,3 Reasons You Should NOT Become a Data Scientist,2019-12-16,101027,2923,0,204,m5pwx3hgtzM
234,5 Sports Analytics Books to Get You Started,2019-12-13,11472,427,0,60,74Z3F7i4qcI
235,Math Needed for Mastering Data Science,2019-12-09,58162,2907,0,222,zSwM5uVeylU
236,The 5 Stages of Data Science Adoption,2019-12-06,1343,68,0,17,BXmEmIK5aqI
237,How YOU Can Land a Sports Analytics Job,2019-12-02,72302,3160,0,232,SLC5sPZSLY4
238,Data Science Fundamentals: Linear Regression,2019-11-29,6476,174,0,42,EAezvs0eL1s
239,Golf: Would You Rather Be the LONGEST or STRAIGHTEST Driver on the PGA Tour?,2019-11-25,1196,54,0,12,k4r_NtB4JVQ
240,Sports Analytics 101: The Pythagorean Theorem of Sports,2019-11-22,6613,281,0,26,ZWdyBbgGZBQ
241,9 Ways You Can Make Extra Income as a Data Scientist,2019-11-18,46677,1760,0,79,1FrY7ARSf10
242,Applying Data Science To My YouTube Data: My Surprising Findings,2019-11-11,5986,139,0,31,LGEuDWjWQes
243,Why Selling Is An Important Data Science Skill,2019-11-04,1659,81,0,13,fjVVtvp5X0w
244,By The Numbers: Where Should The NBA Put a 4 Point Line?,2019-10-21,2984,72,0,18,-kX2b6TF_9k
245,Why is Balance Important in Data Science?,2019-10-16,718,32,0,13,3ysXGYjvbSU
246,How to Stay Productive & Motivated When Learning Data Science,2019-09-29,12048,583,0,55,akbU9KOo_Qc
247,How Far Should the NBA 3-Point Line Actually Be?,2019-09-21,4188,120,0,35,3BEtGaz70rQ
248,6 Habits of Successful Data Scientists,2019-09-13,2265,97,0,17,RRXWJVX0fE8
249,How To Build A Word Cloud From Scraped Data (Python),2019-09-04,5027,105,0,10,k-gin1qfzi0
250,Thank You For The Support | What's Next | Ken Jee | Data Science,2019-08-26,522,24,0,29,Zz_Mx1UPswI
251,Is Data Science Right For You?,2019-08-18,52278,1191,0,109,3Mm1U1CbzNw
252,Data Science Fundamentals: Data Cleaning in Python,2019-08-11,15238,394,0,55,4yI3vVe0Jos
253,How To Get Data Science Experience (Without a Job),2019-08-08,29921,1390,0,77,pWVQ0vN5uig
254,Take Your Data Science Projects From Good to Great,2019-08-05,1642,110,0,11,a-Syoa9mPhM
255,The Projects You Should Do To Get A Data Science Job,2019-07-30,153762,5748,0,255,yukdXV9LR48
256,What Does a Data Scientist Actually Do?,2019-07-19,49657,1309,0,80,XWetgrNas-k
257,Data Science Fundamentals: Data Manipulation in Python (Pandas),2019-07-13,13256,358,0,44,yIJrCFXs0rU
258,Data Science Fundamentals: Data Exploration in Python (Pandas),2019-07-05,18376,538,0,61,Z9dGmL2G-4k
259,Data Science: Pros and Cons,2019-06-30,5541,226,0,18,T7BQJJIGrmc
260,How I Got My First Data Science Internship (And How You Can Land One),2019-06-21,26032,1230,0,89,T77uVbLhroQ
261,My Top 5 Data Science Internship Tips,2019-06-15,12163,502,0,24,1Cf7SdnBncg
262,Golf STATS: Strokes Gained Explained,2019-06-07,7982,162,0,30,3cDM9Z-fdz4
263,Most Data Science Hopefuls Overlook This Important Skill,2019-05-25,622,44,0,5,Yr5T3T4tq-g
264,What I Learned From My Three Degrees,2019-05-17,1291,61,0,12,KMOA5arCi8g
265,I Wish I Had Known THIS Before Starting in Data Science,2019-05-14,25700,1067,0,66,Z_KFh-HqaBA
266,NASA Physicist Turned Data Scientist (Tim Bowling) - KNN EP. 02,2019-05-05,1269,40,0,2,5jntoZX-Tc8
267,Should You Learn R for Data Science?,2019-04-25,21988,573,0,72,AxP1CL0yaFQ
